{"contract_version":"1.0.0","manifest":{"artifact_digest":"sha256:aaaaaaaaaaaaaaaaaaaaaaaaaaaaaaaaaaaaaaaaaaaaaaaaaaaaaaaaaaaaaaaa","contract_version":"1.0.0","manifest_id":"0198d6c4-1111-7111-8111-111111111111","maximum_action_tier":"T2","operations":[{"baseline_action_tier":"T1","cancellation_mode":"cooperative","credential_classes":["query_reader"],"input_fields":[{"enum":[],"maximum":null,"maximum_bytes":71,"maximum_items":0,"minimum":null,"name":"query_digest","required":true,"type":"digest"},{"enum":[],"maximum":3600,"maximum_bytes":0,"maximum_items":0,"minimum":1,"name":"timeout_seconds","required":false,"type":"integer"}],"input_schema_version":"coh.tool-input/v1","isolation_class":"native_restricted","maximum_action_tier":"T2","name":"execute","network_policy":{"dns_mode":"broker_resolved","maximum_connections":8,"metadata_allowed":false,"mode":"target_only","protocols":["tcp"],"public_internet_allowed":false},"resource_limits":{"cpu_milliseconds":30000,"ephemeral_storage_bytes":67108864,"memory_bytes":268435456,"open_file_count":128,"output_bytes":16777216,"process_count":4,"wall_time_milliseconds":60000},"retry_mode":"reconcile"}],"publisher_id":"0198d6c4-2222-7222-8222-222222222222","review_decision":"approved","review_id":"0198d6c4-3333-7333-8333-333333333333","review_revision":2,"reviewed_at":"2026-08-26T01:30:00.000000000Z","reviewer_actor_ids":["0198d6c4-4444-7444-8444-444444444444"],"schema_version":"coh.tool-manifest/v1","threat_model_digest":"sha256:bbbbbbbbbbbbbbbbbbbbbbbbbbbbbbbbbbbbbbbbbbbbbbbbbbbbbbbbbbbbbbbb","tool_name":"query.execute","tool_version":"1.2.3","valid_from":"2026-08-26T02:29:00.000000000Z","valid_until":"2026-08-26T03:30:00.000000000Z"},"manifest_digest":"sha256:f2c5e4239f4484dc92258196a61bdeb1026d4ec4b19b3e3e6d2b9555589519a3","publisher_id":"0198d6c4-2222-7222-8222-222222222222","publisher_key_id":"publisher.primary","publisher_key_revision":3,"schema_version":"coh.signed-tool-manifest/v1","signature":"NtHo5iOWZ5rIrz3ghGhh3W-43NE_MYXykSVtuxx_nnfRuzhmMP5CpBQi03baYlp_3Jknl6rj-v8oC4v2fP3FDQ","signature_algorithm":"ed25519"}
